{
  "claim": {
    "candidateClaims": [
      {
        "candidateId": "w_11301_damage_1",
        "claimId": "weapon:w_11301_damage_1:activation",
        "disposition": {
          "blockers": [
            "officialEndpointMutableNoImmutableRevision",
            "strictGameVersionBindingMissing",
            "candidateClaimSemanticFieldMappingNotMaterialized",
            "singleOfficialSourceFamily"
          ],
          "canIssueEligibilityCertificate": false,
          "canPromoteCanonical": false,
          "status": "blocked"
        },
        "entityId": "11301",
        "field": "activation",
        "fieldCoverage": {
          "conditionScope": "notMaterialized",
          "exactFieldIdentity": "passiveTextField",
          "noNumericInference": true,
          "noTranslationInference": true,
          "rawTextAvailable": true,
          "refinementScope": "rawTextContainsObservedTableButNotStructuredHere",
          "semanticComparison": "notPerformed",
          "structuredClaimValue": "notMaterialized",
          "targetScope": "notMaterialized"
        },
        "localCandidateEvidence": {
          "localEffectRecordDigest": "74551459b5160795dc820de33b8443581d3fb10210dda1738e2d626e8ae7f2d0",
          "source": "authoritative queue + local v2 verification",
          "status": "legacyCandidateNeedsIndependentReview",
          "verificationCandidateDigest": "8a21c1f81b6381e06197f36a2b260850ff1ffaba67a699a9c34268e66c72d4ce"
        },
        "providerField": {
          "key": "Bane of Water and Ice",
          "providerEntryId": "baseInfo13575",
          "rawLocator": {
            "embeddedJsonPointer": "/list/5",
            "embeddedValuePointer": "/list/5/value",
            "outerJsonPointer": "/data/page/modules/0/components/0/data",
            "rawArtifactBytes": 13290,
            "rawArtifactPath": "games/genshin/data/v2/version-transitions/6.7-to-7.0/sources/hoyowiki-official-weapon-frontier-11301-11303/entries/1938.json",
            "rawArtifactSha256": "1e897cea9398146815271cc326335acbf71abc87f04bbffb075470615bec8f93"
          },
          "rawValue": [
            "<p>Increases DMG against opponents affected by Hydro or Cryo by <span style=\"color: rgb(55, 255, 255)\">12%/15%/18%/21%/24%</span>.</p>"
          ],
          "status": "rawFieldPresent",
          "valueDigest": "83bf7f84c5c742f57680bf2a4ae51531a93bff4469a45af124f99701b73fc0a0"
        },
        "strictGameVersionBinding": {
          "captureTimestampIsNotVersionEvidence": true,
          "providerReleaseField": "1.0",
          "status": "missing",
          "targetGameVersion": "7.0"
        }
      },
      {
        "candidateId": "w_11301_damage_1",
        "claimId": "weapon:w_11301_damage_1:refinement",
        "disposition": {
          "blockers": [
            "officialEndpointMutableNoImmutableRevision",
            "strictGameVersionBindingMissing",
            "candidateClaimSemanticFieldMappingNotMaterialized",
            "singleOfficialSourceFamily"
          ],
          "canIssueEligibilityCertificate": false,
          "canPromoteCanonical": false,
          "status": "blocked"
        },
        "entityId": "11301",
        "field": "refinement",
        "fieldCoverage": {
          "conditionScope": "notMaterialized",
          "exactFieldIdentity": "passiveTextField",
          "noNumericInference": true,
          "noTranslationInference": true,
          "rawTextAvailable": true,
          "refinementScope": "rawTextContainsObservedTableButNotStructuredHere",
          "semanticComparison": "notPerformed",
          "structuredClaimValue": "notMaterialized",
          "targetScope": "notMaterialized"
        },
        "localCandidateEvidence": {
          "localEffectRecordDigest": "74551459b5160795dc820de33b8443581d3fb10210dda1738e2d626e8ae7f2d0",
          "source": "authoritative queue + local v2 verification",
          "status": "legacyCandidateNeedsIndependentReview",
          "verificationCandidateDigest": "8a21c1f81b6381e06197f36a2b260850ff1ffaba67a699a9c34268e66c72d4ce"
        },
        "providerField": {
          "key": "Bane of Water and Ice",
          "providerEntryId": "baseInfo13575",
          "rawLocator": {
            "embeddedJsonPointer": "/list/5",
            "embeddedValuePointer": "/list/5/value",
            "outerJsonPointer": "/data/page/modules/0/components/0/data",
            "rawArtifactBytes": 13290,
            "rawArtifactPath": "games/genshin/data/v2/version-transitions/6.7-to-7.0/sources/hoyowiki-official-weapon-frontier-11301-11303/entries/1938.json",
            "rawArtifactSha256": "1e897cea9398146815271cc326335acbf71abc87f04bbffb075470615bec8f93"
          },
          "rawValue": [
            "<p>Increases DMG against opponents affected by Hydro or Cryo by <span style=\"color: rgb(55, 255, 255)\">12%/15%/18%/21%/24%</span>.</p>"
          ],
          "status": "rawFieldPresent",
          "valueDigest": "83bf7f84c5c742f57680bf2a4ae51531a93bff4469a45af124f99701b73fc0a0"
        },
        "strictGameVersionBinding": {
          "captureTimestampIsNotVersionEvidence": true,
          "providerReleaseField": "1.0",
          "status": "missing",
          "targetGameVersion": "7.0"
        }
      },
      {
        "candidateId": "w_11301_damage_1",
        "claimId": "weapon:w_11301_damage_1:targets",
        "disposition": {
          "blockers": [
            "officialEndpointMutableNoImmutableRevision",
            "strictGameVersionBindingMissing",
            "candidateClaimSemanticFieldMappingNotMaterialized",
            "singleOfficialSourceFamily"
          ],
          "canIssueEligibilityCertificate": false,
          "canPromoteCanonical": false,
          "status": "blocked"
        },
        "entityId": "11301",
        "field": "targets",
        "fieldCoverage": {
          "conditionScope": "notMaterialized",
          "exactFieldIdentity": "passiveTextField",
          "noNumericInference": true,
          "noTranslationInference": true,
          "rawTextAvailable": true,
          "refinementScope": "rawTextContainsObservedTableButNotStructuredHere",
          "semanticComparison": "notPerformed",
          "structuredClaimValue": "notMaterialized",
          "targetScope": "notMaterialized"
        },
        "localCandidateEvidence": {
          "localEffectRecordDigest": "74551459b5160795dc820de33b8443581d3fb10210dda1738e2d626e8ae7f2d0",
          "source": "authoritative queue + local v2 verification",
          "status": "legacyCandidateNeedsIndependentReview",
          "verificationCandidateDigest": "8a21c1f81b6381e06197f36a2b260850ff1ffaba67a699a9c34268e66c72d4ce"
        },
        "providerField": {
          "key": "Bane of Water and Ice",
          "providerEntryId": "baseInfo13575",
          "rawLocator": {
            "embeddedJsonPointer": "/list/5",
            "embeddedValuePointer": "/list/5/value",
            "outerJsonPointer": "/data/page/modules/0/components/0/data",
            "rawArtifactBytes": 13290,
            "rawArtifactPath": "games/genshin/data/v2/version-transitions/6.7-to-7.0/sources/hoyowiki-official-weapon-frontier-11301-11303/entries/1938.json",
            "rawArtifactSha256": "1e897cea9398146815271cc326335acbf71abc87f04bbffb075470615bec8f93"
          },
          "rawValue": [
            "<p>Increases DMG against opponents affected by Hydro or Cryo by <span style=\"color: rgb(55, 255, 255)\">12%/15%/18%/21%/24%</span>.</p>"
          ],
          "status": "rawFieldPresent",
          "valueDigest": "83bf7f84c5c742f57680bf2a4ae51531a93bff4469a45af124f99701b73fc0a0"
        },
        "strictGameVersionBinding": {
          "captureTimestampIsNotVersionEvidence": true,
          "providerReleaseField": "1.0",
          "status": "missing",
          "targetGameVersion": "7.0"
        }
      },
      {
        "candidateId": "w_11301_damage_1",
        "claimId": "weapon:w_11301_damage_1:value",
        "disposition": {
          "blockers": [
            "officialEndpointMutableNoImmutableRevision",
            "strictGameVersionBindingMissing",
            "candidateClaimSemanticFieldMappingNotMaterialized",
            "singleOfficialSourceFamily"
          ],
          "canIssueEligibilityCertificate": false,
          "canPromoteCanonical": false,
          "status": "blocked"
        },
        "entityId": "11301",
        "field": "value",
        "fieldCoverage": {
          "conditionScope": "notMaterialized",
          "exactFieldIdentity": "passiveTextField",
          "noNumericInference": true,
          "noTranslationInference": true,
          "rawTextAvailable": true,
          "refinementScope": "rawTextContainsObservedTableButNotStructuredHere",
          "semanticComparison": "notPerformed",
          "structuredClaimValue": "notMaterialized",
          "targetScope": "notMaterialized"
        },
        "localCandidateEvidence": {
          "localEffectRecordDigest": "74551459b5160795dc820de33b8443581d3fb10210dda1738e2d626e8ae7f2d0",
          "source": "authoritative queue + local v2 verification",
          "status": "legacyCandidateNeedsIndependentReview",
          "verificationCandidateDigest": "8a21c1f81b6381e06197f36a2b260850ff1ffaba67a699a9c34268e66c72d4ce"
        },
        "providerField": {
          "key": "Bane of Water and Ice",
          "providerEntryId": "baseInfo13575",
          "rawLocator": {
            "embeddedJsonPointer": "/list/5",
            "embeddedValuePointer": "/list/5/value",
            "outerJsonPointer": "/data/page/modules/0/components/0/data",
            "rawArtifactBytes": 13290,
            "rawArtifactPath": "games/genshin/data/v2/version-transitions/6.7-to-7.0/sources/hoyowiki-official-weapon-frontier-11301-11303/entries/1938.json",
            "rawArtifactSha256": "1e897cea9398146815271cc326335acbf71abc87f04bbffb075470615bec8f93"
          },
          "rawValue": [